phil_id,name,era,summary
92,John Wycliffe,Medieval,"""John Wycliffe (; also spelled Wyclif, Wycliff, Wiclef, Wicliffe, Wickliffe; 1320s – 31 December 1384) was an English scholastic philosopher, theologian, Biblical translator, reformer, and seminary professor at Oxford. He was an influential dissident within the Roman Catholic priesthood during the 14th century.
Wycliffe attacked the privileged status of the clergy, which was central to their powerful role in England. He then attacked the luxury and pomp of local parishes and their ceremonies.
Wycliffe was also an advocate for translation of the Bible into the vernacular. He completed a translation directly from the Vulgate into Middle English in the year 1382, now known as Wycliffe's Bible. It is probable that he personally translated the Gospels of Matthew, Mark, Luke, and John; and it is possible he translated the entire New Testament, while his associates translated the Old Testament. Wycliffe's Bible appears to have been completed by 1384, additional updated versions being done by Wycliffe's assistant John Purvey and others in 1388 and 1395.
Wycliffe's followers were known as Lollards and followed his lead in advocating predestination, iconoclasm, and the notion of caesaropapism, while attacking the veneration of saints, the sacraments, requiem masses, transubstantiation, monasticism, and the very existence of the Papacy.
Beginning in the 16th century, the Lollard movement was regarded as the precursor to the Protestant Reformation. Wycliffe was accordingly characterised as the evening star of scholasticism and the morning star of the English Reformation. Wycliffe's writings in Latin greatly influenced the philosophy and teaching of Czech reformer Jan Hus, whose execution in 1415 sparked a revolt and led to the Hussite Wars."""
93,Nicole Oresme,Medieval,"""Nicole Oresme (French: [nikɔl ɔʁɛm]; c. 1320–1325 – July 11, 1382), also known as Nicolas Oresme, Nicholas Oresme, or Nicolas d'Oresme, was a significant philosopher of the later Middle Ages. He wrote influential works on economics, mathematics, physics, astrology and astronomy, philosophy, and theology; was Bishop of Lisieux, a translator, a counselor of King Charles V of France, and probably one of the most original thinkers of 14th-century Europe."""
94,Hasdai Crescas,Medieval,"""Hasdai ben Abraham Crescas (Catalan: [həzˈðaj ˈβeɲ ʒuˈða ˈkɾeskəs]; Hebrew: חסדאי קרשקש; c. 1340, in Barcelona – 1410/11, in Zaragoza) was a Spanish-Jewish philosopher and a renowned halakhist (teacher of Jewish law). Along with Maimonides ('Rambam'), Gersonides ('Ralbag'), and Joseph Albo, he is known as one of the major practitioners of the rationalist approach to Jewish philosophy.

"""
95,Gemistus Pletho,Medieval,"""Georgius Gemistus (Greek: Γεώργιος Γεμιστός; c. 1355 – 1452/1454), later called Plethon () or Pletho (; Πλήθων), was a Greek scholar of Neoplatonic philosophy. He was one of the chief pioneers of the revival of Greek learning in Western Europe. In the dying years of the Byzantine Empire, he advocated a return to the Olympian gods of the ancient world.
He re-introduced Plato's thoughts to Western Europe during the 1438–1439 Council of Florence, a failed attempt to reconcile the East-West schism. Here Pletho met and influenced Cosimo de' Medici to found a new Platonic Academy, which, under Marsilio Ficino, would proceed to translate into Latin all Plato's works, the Enneads of Plotinus, and various other Neoplatonist works."""
96,Nicholas of Cusa,Medieval,"""Nicholas of Cusa (1401 – 11 August 1464), also referred to as Nicholas of Kues and Nicolaus Cusanus, was a German philosopher, theologian, jurist, and astronomer. One of the first German proponents of Renaissance humanism, he made spiritual and political contributions in European history. A notable example of this is his mystical or spiritual writings on 'learned ignorance,' as well as his participation in power struggles between Rome and the German states of the Holy Roman Empire.
Papal legate to Germany from 1446, he was appointed cardinal for his merits by Pope Nicholas V in 1448 and Prince–Bishop of Brixen two years later. In 1459 he became vicar general in the Papal States.
Nicholas of Cusa has remained an influential figure. In 2001, the sixth centennial of his birth was celebrated on four continents and commemorated by publications on his life and work."""
97,Lorenzo Valla,Medieval,"""Lorenzo (or Laurentius) Valla (Italian pronunciation: [loˈrɛnt͡so ˈvalːa]; c.1407 – 1 August 1457) was an Italian humanist, rhetorician, educator and Catholic priest. He is best known for his textual analysis that proved that the Donation of Constantine was a forgery."""
98,Marsilio Ficino,Medieval,"""Marsilio Ficino (Italian: [marˈsiːljo fiˈtʃiːno]; Latin name: Marsilius Ficinus; 19 October 1433 – 1 October 1499) was an Italian scholar and Catholic priest who was one of the most influential humanist philosophers of the early Italian Renaissance. He was an astrologer, a reviver of Neoplatonism in touch with every major academic thinker and writer of his day and the first translator of Plato's complete extant works into Latin. His Florentine Academy, an attempt to revive Plato's Academy, influenced the direction and tenor of the Italian Renaissance and the development of European philosophy."""
99,Giovanni Pico della Mirandola,Medieval,"""Giovanni Pico della Mirandola (Italian: [dʒoˈvanni ˈpiːko della miˈrandola]; 24 February 1463 – 17 November 1494) was an Italian Renaissance nobleman and philosopher. He is famed for the events of 1486, when, at the age of 23, he proposed to defend 900 theses on religion, philosophy, natural philosophy, and magic against all comers, for which he wrote the Oration on the Dignity of Man, which has been called the 'Manifesto of the Renaissance', and a key text of Renaissance humanism and of what has been called the 'Hermetic Reformation'."""
100,Boetius of Dacia,Medieval,"""Boetius de Dacia (also spelled Boethius de Dacia), OP, was a 13th-century Danish philosopher."""
101,Erasmus,Early Modern,"""Desiderius Erasmus Roterodamus (; 28 October 1466 – 12 July 1536), known as Erasmus or Erasmus of Rotterdam, was a Dutch Renaissance humanist, Catholic priest, social critic, teacher, and theologian.
Erasmus was a classical scholar and wrote in a pure Latin style. Among humanists he enjoyed the sobriquet 'Prince of the Humanists', and has been called 'the crowning glory of the Christian humanists'. Using humanist techniques for working on texts, he prepared important new Latin and Greek editions of the New Testament, which raised questions that would be influential in the Protestant Reformation and Catholic Counter-Reformation. He also wrote On Free Will, The Praise of Folly, Handbook of a Christian Knight, On Civility in Children, Copia: Foundations of the Abundant Style, Julius Exclusus, and many other works.
Erasmus lived against the backdrop of the growing European religious Reformation, but while he was critical of the abuses within the Catholic Church and called for reform, he kept his distance from Luther and Melanchthon and continued to recognise the authority of the pope, emphasizing a middle way with a deep respect for traditional faith, piety and grace, rejecting Luther's emphasis on faith alone. Erasmus remained a member of the Roman Catholic Church all his life, remaining committed to reforming the Church and its clerics' abuses from within. He also held to the Catholic doctrine of free will, which some Reformers rejected in favor of the doctrine of predestination. His middle road ('Via Media') approach disappointed, and even angered, scholars in both camps.
Erasmus died suddenly in Basel in 1536 while preparing to return to Brabant, and was buried in Basel Minster, the former cathedral of the city. A bronze statue of Erasmus was erected in 1622 in his city of birth, replacing an earlier work in stone."""
102,Niccolò Machiavelli,Early Modern,"""Niccolò di Bernardo dei Machiavelli (Italian: [nikkoˈlɔ mmakjaˈvɛlli]; 3 May 1469 – 21 June 1527) was an Italian diplomat, politician, historian, philosopher, humanist, and writer of the Renaissance period. He has often been called the father of modern political science. He was for many years a senior official in the Florentine Republic, with responsibilities in diplomatic and military affairs. He also wrote comedies, carnival songs, and poetry. His personal correspondence is renowned in the Italian language. He was secretary to the Second Chancery of the Republic of Florence from 1498 to 1512, when the Medici were out of power. He wrote his most renowned work The Prince (Il Principe) in 1513.
'Machiavellianism' is a widely used negative term to characterize unscrupulous politicians of the sort Machiavelli described most famously in The Prince. Machiavelli described immoral behavior, such as dishonesty and killing innocents, as being normal and effective in politics. He even seemed to endorse it in some situations. The book itself gained notoriety when some readers claimed that the author was teaching evil, and providing 'evil recommendations to tyrants to help them maintain their power.' The term 'Machiavellian' is often associated with political deceit, deviousness, and realpolitik. On the other hand, many commentators, such as Baruch Spinoza, Jean-Jacques Rousseau and Denis Diderot, have argued that Machiavelli was actually a republican, even when writing The Prince, and his writings were an inspiration to Enlightenment proponents of modern democratic political philosophy. In one place for example he noted his admiration for the selfless Roman dictator Cincinnatus."""
103,Thomas More,Early Modern,"""Sir Thomas More (; 7 February 1478 – 6 July 1535), venerated by Roman Catholics as Saint Thomas More, was an English lawyer, social philosopher, author, statesman and noted Renaissance humanist. He was also a councillor to Henry VIII, and Lord High Chancellor of England from October 1529 to 16 May 1532. He wrote Utopia, published in 1516, about the political system of an imaginary ideal island nation.
More opposed the Protestant Reformation, in particular the theology of Martin Luther and William Tyndale. More also opposed the King's separation from the Catholic Church, refusing to acknowledge Henry as Supreme Head of the Church of England and the annulment of his marriage to Catherine of Aragon. After refusing to take the Oath of Supremacy, he was convicted of treason and beheaded. Of his execution, he was reported to have said: 'I die the King's good servant, and God's first.'
Pope Pius XI canonised More in 1935 as a martyr. Pope John Paul II in 2000 declared him the 'heavenly Patron of Statesmen and Politicians.' Since 1980, the Church of England has remembered More liturgically as a Reformation martyr. The Soviet Union honoured him for the supposedly communist attitude toward property rights expressed in Utopia."""
104,Martin Luther,Early Modern,"""Martin Luther (; German: [ˈmaɐ̯tiːn ˈlʊtɐ]; 10 November 1483 – 18 February 1546), O.S.A., was a German professor of theology, composer, priest, monk and a seminal figure in the Protestant Reformation.
Luther came to reject several teachings and practices of the Roman Catholic Church. He strongly disputed the Catholic view on indulgences as he understood it to be, that freedom from God's punishment for sin could be purchased with money. Luther proposed an academic discussion of the practice and efficacy of indulgences in his Ninety-five Theses of 1517. His refusal to renounce all of his writings at the demand of Pope Leo X in 1520 and the Holy Roman Emperor Charles V at the Diet of Worms in 1521 resulted in his excommunication by the Pope and condemnation as an outlaw by the Emperor.
Luther taught that salvation and, consequently, eternal life are not earned by good deeds but are received only as the free gift of God's grace through the believer's faith in Jesus Christ as redeemer from sin. His theology challenged the authority and office of the Pope by teaching that the Bible is the only source of divinely revealed knowledge from God and opposed sacerdotalism by considering all baptized Christians to be a holy priesthood. Those who identify with these, and all of Luther's wider teachings, are called Lutherans, though Luther insisted on Christian or Evangelical as the only acceptable names for individuals who professed Christ.
His translation of the Bible into the German vernacular (instead of Latin) made it more accessible to the laity, an event that had a tremendous impact on both the church and German culture. It fostered the development of a standard version of the German language, added several principles to the art of translation, and influenced the writing of an English translation, the Tyndale Bible. His hymns influenced the development of singing in Protestant churches. His marriage to Katharina von Bora, a former nun, set a model for the practice of clerical marriage, allowing Protestant clergy to marry.
In two of his later works, Luther expressed antagonistic views towards Jews, writing that Jewish homes and synagogues should be destroyed, their money confiscated, and liberty curtailed. Condemned by virtually every Lutheran denomination, these statements and their influence on antisemitism have contributed to his controversial status."""
105,Petrus Ramus,Early Modern,"""Petrus Ramus (French: Pierre de la Ramée; Anglicized to Peter Ramus ; 1515 – 26 August 1572) was an influential French humanist, logician, and educational reformer. A Protestant convert, he was killed during the St. Bartholomew's Day Massacre.

"""
106,John Calvin,Early Modern,"""John Calvin (; French: Jean Calvin, pronounced [ʒɑ̃ kalvɛ̃]; born Jehan Cauvin: 10 July 1509 – 27 May 1564) was an influential French theologian, pastor and reformer during the Protestant Reformation. He was a principal figure in the development of the system of Christian theology later called Calvinism, aspects of which include the doctrines of predestination and of the absolute sovereignty of God in salvation of the human soul from death and eternal damnation, in which doctrines Calvin was influenced by and elaborated upon the Augustinian and other Christian traditions. Various Congregational, Reformed, and Presbyterian churches, which look to Calvin as the chief expositor of their beliefs, have spread throughout the world.
Calvin was a tireless polemic and apologetic writer who generated much controversy. He also exchanged cordial and supportive letters with many reformers, including Philipp Melanchthon and Heinrich Bullinger. In addition to his seminal Institutes of the Christian Religion, Calvin wrote commentaries on most books of the Bible, confessional documents, and various other theological treatises.
Originally trained as a humanist lawyer, he broke from the Roman Catholic Church around 1530. After religious tensions erupted in widespread deadly violence against Protestant Christians in France, Calvin fled to Basel, Switzerland, where in 1536 he published the first edition of the Institutes. In that same year, Calvin was recruited by Frenchman William Farel to join the Reformation in Geneva, where he regularly preached sermons throughout the week; but the governing council of the city resisted the implementation of their ideas, and both men were expelled. At the invitation of Martin Bucer, Calvin proceeded to Strasbourg, where he became the minister of a church of French refugees. He continued to support the reform movement in Geneva, and in 1541 he was invited back to lead the church of the city.
Following his return, Calvin introduced new forms of church government and liturgy, despite opposition from several powerful families in the city who tried to curb his authority. During this period, Michael Servetus, a Spaniard regarded by both Roman Catholics and Protestants as having a heretical view of the Trinity, arrived in Geneva. He was denounced by Calvin and burned at the stake for heresy by the city council. Following an influx of supportive refugees and new elections to the city council, Calvin's opponents were forced out. Calvin spent his final years promoting the Reformation both in Geneva and throughout Europe."""
107,Michel de Montaigne,Early Modern,"""Michel Eyquem de Montaigne, Lord of Montaigne (; French: [miʃɛl ekɛm də mɔ̃tɛɲ]; 28 February 1533 – 13 September 1592) was one of the most significant philosophers of the French Renaissance, known for popularizing the essay as a literary genre. His work is noted for its merging of casual anecdotes and autobiography with serious intellectual insight; his massive volume Essais contains some of the most influential essays ever written.
Montaigne had a direct influence on Western writers, including Francis Bacon, René Descartes, Blaise Pascal, Jean-Jacques Rousseau, Albert Hirschman, William Hazlitt, Ralph Waldo Emerson, Friedrich Nietzsche, Stefan Zweig, Eric Hoffer, Isaac Asimov, and possibly on the later works of William Shakespeare.
In his own lifetime, Montaigne was admired more as a statesman than as an author. The tendency in his essays to digress into anecdotes and personal ruminations was seen as detrimental to proper style rather than as an innovation, and his declaration that, 'I am myself the matter of my book', was viewed by his contemporaries as self-indulgent. In time, however, Montaigne would come to be recognized as embodying, perhaps better than any other author of his time, the spirit of freely entertaining doubt which began to emerge at that time. He is most famously known for his skeptical remark, 'Que sçay-je?' ('What do I know?', in Middle French; now rendered as Que sais-je? in modern French).
Remarkably modern even to readers today, Montaigne's attempt to examine the world through the lens of the only thing he can depend on implicitly—his own judgment—makes him more accessible to modern readers than any other author of the Renaissance. Much of modern literary non-fiction has found inspiration in Montaigne and writers of all kinds continue to read him for his masterful balance of intellectual knowledge and personal storytelling."""
108,Pierre Charron,Early Modern,"""Pierre Charron (French pronunciation: ​[pjɛʁ ʃaʁɔ̃]; 1541 – 16 November 1603) was a French 16th-century Catholic theologian and philosopher, and a disciple and contemporary of Michel de Montaigne.

"""
109,Giordano Bruno,Early Modern,"""Giordano Bruno (; Italian: [dʒorˈdano ˈbruno]; Latin: Iordanus Brunus Nolanus; 1548 – 17 February 1600), born Filippo Bruno, was an Italian Dominican friar, philosopher, mathematician, poet, and cosmological theorist. He is known for his cosmological theories, which conceptually extended the then-novel Copernican model. He proposed that the stars were just distant suns surrounded by their own exoplanets and raised the possibility that these planets could even foster life of their own (a philosophical position known as cosmic pluralism). He also insisted that the universe is in fact infinite and could have no celestial body at its 'center'.
Beginning in 1593, Bruno was tried for heresy by the Roman Inquisition on charges including denial of several core Catholic doctrines, including eternal damnation, the Trinity, the divinity of Christ, the virginity of Mary, and transubstantiation. Bruno's pantheism was also a matter of grave concern, as was his teaching of the transmigration of the soul (reincarnation). The Inquisition found him guilty, and he was burned at the stake in Rome's Campo de' Fiori in 1600. After his death, he gained considerable fame, being particularly celebrated by 19th- and early 20th-century commentators who regarded him as a martyr for science, although historians have debated the extent to which his heresy trial was a response to his astronomical views or to other aspects of his philosophy and theology. Bruno's case is still considered a landmark in the history of free thought and the emerging sciences.
In addition to cosmology, Bruno also wrote extensively on the art of memory, a loosely organized group of mnemonic techniques and principles. Historian Frances Yates argues that Bruno was deeply influenced by Arab astrology (particularly the philosophy of Averroes), Neoplatonism, Renaissance Hermeticism, and legends surrounding the Egyptian god Thoth. Other studies of Bruno have focused on his qualitative approach to mathematics and his application of the spatial concepts of geometry to language."""
110,Francisco Suarez,Early Modern,"""Francisco Suárez (5 January 1548 – 25 September 1617) was a Spanish Jesuit priest, philosopher and theologian, one of the leading figures of the School of Salamanca movement, and generally regarded among the greatest scholastics after Thomas Aquinas. His work is considered a turning point in the history of second scholasticism, marking the transition from its Renaissance to its Baroque phases. According to Christopher Shields and Daniel Schwartz, 'figures as distinct from one another in place, time, and philosophical orientation as Leibniz, Grotius, Pufendorf, Schopenhauer, and Heidegger, all found reason to cite him as a source of inspiration and influence.'"""
111,Francis Bacon,Early Modern,"""Francis Bacon, 1st Viscount St Alban,  (; 22 January 1561 – 9 April 1626) was an English philosopher, statesman, scientist, jurist, orator, and author. He served both as Attorney General and as Lord Chancellor of England. After his death, he remained extremely influential through his works, especially as philosophical advocate and practitioner of the scientific method during the scientific revolution.
Bacon has been called the father of empiricism. His works argued for the possibility of scientific knowledge based only upon inductive reasoning and careful observation of events in nature. Most importantly, he argued this could be achieved by use of a sceptical and methodical approach whereby scientists aim to avoid misleading themselves. While his own practical ideas about such a method, the Baconian method, did not have a long lasting influence, the general idea of the importance and possibility of a sceptical methodology makes Bacon the father of scientific method. This marked a new turn in the rhetorical and theoretical framework for science, the practical details of which are still central in debates about science and methodology today.
Bacon was generally neglected at court by Queen Elizabeth, but after the accession of King James I in 1603, Bacon was knighted. He was later created Baron Verulam in 1618 and Viscount St. Alban in 1621. Because he had no heirs, both titles became extinct upon his death in 1626, at 65 years of age. Bacon died of pneumonia, with one account by John Aubrey stating that he had contracted the condition while studying the effects of freezing on the preservation of meat. He is buried at St Michael's Church, St Albans, Hertfordshire."""
112,Galileo Galilei,Early Modern,"""Galileo Galilei (Italian: [ɡaliˈlɛːo ɡaliˈlɛi]; 15 February 1564 – 8 January 1642) was an Italian polymath: astronomer, physicist, engineer, philosopher, and mathematician. He has been called the 'father of observational astronomy', the 'father of modern physics', the 'father of the scientific method', and the 'father of science'. Galileo studied speed and velocity, gravity and free fall, the principle of relativity, inertia, projectile motion and also worked in applied science and technology, describing the properties of pendulums and 'hydrostatic balances', inventing the thermoscope and various military compasses, and using the telescope (a Dutch optical instrument) for scientific observations of celestial objects.
Galileo is a central figure in the transition from natural philosophy to modern science and in the transformation of the scientific Renaissance into a scientific revolution. His contributions to observational astronomy include the telescopic confirmation of the phases of Venus, the discovery of the four largest satellites of Jupiter, the observation of Saturn's rings (though he could not see them well enough to discern their true nature) and the analysis of sunspots.
Galileo's championing of heliocentrism and Copernicanism was controversial during his lifetime, when most subscribed to either geocentrism or the Tychonic system. He met with opposition from astronomers, who doubted heliocentrism because of the absence of an observed stellar parallax. The matter was investigated by the Roman Inquisition in 1615, which concluded that heliocentrism was 'foolish and absurd in philosophy, and formally heretical since it explicitly contradicts in many places the sense of Holy Scripture.' Galileo later defended his views in Dialogue Concerning the Two Chief World Systems, which appeared to attack Pope Urban VIII and thus alienated him and the Jesuits, who had both supported Galileo up until this point. He was tried by the Inquisition, found 'vehemently suspect of heresy', and forced to recant. He spent the rest of his life under house arrest. While under house arrest, he wrote one of his best-known works, Two New Sciences, in which he summarized work he had done some forty years earlier on the two sciences now called kinematics and strength of materials."""
