phil_id,name,era,summary
265,Bertrand Russell,Modern,"""Bertrand Arthur William Russell, 3rd Earl Russell,  (; 18 May 1872 – 2 February 1970) was a British philosopher, logician, mathematician, historian, writer, social critic, political activist and Nobel laureate. At various points in his life he considered himself a liberal, a socialist, and a pacifist, but he also admitted that he had 'never been any of these things, in any profound sense'. He was born in Monmouthshire into one of the most prominent aristocratic families in the United Kingdom.
In the early 20th century, Russell led the British 'revolt against idealism'. He is considered one of the founders of analytic philosophy along with his predecessor Gottlob Frege, colleague G. E. Moore, and protégé Ludwig Wittgenstein. He is widely held to be one of the 20th century's premier logicians. With A. N. Whitehead he wrote Principia Mathematica, an attempt to create a logical basis for mathematics. His philosophical essay 'On Denoting' has been considered a 'paradigm of philosophy'. His work has had a considerable influence on mathematics, logic, set theory, linguistics, artificial intelligence, cognitive science, computer science (see type theory and type system), and philosophy, especially the philosophy of language, epistemology, and metaphysics.
Russell was a prominent anti-war activist; he championed anti-imperialism. Occasionally, he advocated preventive nuclear war, before the opportunity provided by the atomic monopoly had passed, and 'welcomed with enthusiasm' world government. He went to prison for his pacifism during World War I. Later, he concluded war against Adolf Hitler was a necessary 'lesser of two evils'. He criticized Stalinist totalitarianism, attacked the involvement of the United States in the Vietnam War, and was an outspoken proponent of nuclear disarmament. In 1950 Russell was awarded the Nobel Prize in Literature 'in recognition of his varied and significant writings in which he champions humanitarian ideals and freedom of thought'."""
266,Arthur Oncken Lovejoy,Modern,"""Arthur Oncken Lovejoy (October 10, 1873 – December 30, 1962) was an American philosopher and intellectual historian, who founded the discipline known as the history of ideas with his book The Great Chain of Being (1936), on the topic of that name, which is regarded as 'probably the single most influential work in the history of ideas in the United States during the last half century'."""
267,Nikolai Berdyaev,Modern,"""Nikolai Alexandrovich Berdyaev (; Russian: Никола́й Алекса́ндрович Бердя́ев; March 18 [O.S. March 6] 1874 – March 24, 1948) was a Russian Orthodox religious and political philosopher. Alternate historical spellings of his name in English include 'Berdiaev' and 'Berdiaeff', and of his given name as ''Nicolas' and 'Nicholas'."""
268,Ernst Cassirer,Modern,"""Ernst Cassirer (; German: [kaˈsiːʁɐ]; July 28, 1874 – April 13, 1945) was a German philosopher. Trained within the Neo-Kantian Marburg School, he initially followed his mentor Hermann Cohen in attempting to supply an idealistic philosophy of science.
After Cohen's death, Cassirer developed a theory of symbolism and used it to expand phenomenology of knowledge into a more general philosophy of culture.
Cassirer was one of the leading 20th century advocates of philosophical idealism."""
269,Max Scheler,Modern,"""Max Ferdinand Scheler (German: [ˈʃeːlɐ]; 22 August 1874 – 19 May 1928) was a German philosopher known for his work in phenomenology, ethics, and philosophical anthropology. Scheler developed further the philosophical method of the founder of phenomenology, Edmund Husserl, and was called by José Ortega y Gasset 'the first man of the philosophical paradise.' After his death in 1928, Martin Heidegger affirmed, with Ortega y Gasset, that all philosophers of the century were indebted to Scheler and praised him as 'the strongest philosophical force in modern Germany, nay, in contemporary Europe and in contemporary philosophy as such.' In 1954, Karol Wojtyła, later Pope John Paul II, defended his doctoral thesis on 'An Evaluation of the Possibility of Constructing a Christian Ethics on the Basis of the System of Max Scheler.'"""
270,Giovanni Gentile,Modern,"""Giovanni Gentile (Italian: [dʒoˈvanni dʒenˈtiːle]; 30 May 1875 – 15 April 1944) was an Italian neo-Hegelian idealist philosopher, educator, and fascist politician, and a peer of Benedetto Croce. The self-styled 'philosopher of Fascism', he was influential in providing an intellectual foundation for Italian Fascist thought, and ghostwrote part of The Doctrine of Fascism (1932) with Benito Mussolini. He was involved in the resurgence of Hegelian idealism in Italian philosophy and also devised his own system of thought, which he called 'actual idealism' or 'actualism', and which has been described as 'the subjective extreme of the idealist tradition'."""
271,Ralph Barton Perry,Modern,"""Ralph Barton Perry (July 3, 1876 in Poultney, Vermont – January 22, 1957 in Boston, Massachusetts) was an American philosopher."""
272,W.D. Ross,Modern,"""Sir William David Ross KBE FBA (; 15 April 1877 – 5 May 1971), known as David Ross but usually cited as W. D. Ross, was a Scottish philosopher who is known for his work in ethics. His best-known work is The Right and the Good (1930), and he is perhaps best known for developing a pluralist, deontological form of intuitionist ethics in response to G.E. Moore's intuitionism. Ross also critically edited and translated a number of Aristotle's works, in addition to writing on Greek philosophy."""
273,Pierre Teilhard de Chardin,Modern,"""Pierre Teilhard de Chardin SJ (French: [pjɛʁ tejaʁ də ʃaʁdɛ̃] ( listen ); 1 May 1881 – 10 April 1955) was a French idealist philosopher and Jesuit priest who trained as a paleontologist and geologist and took part in the discovery of Peking Man. He conceived the vitalist idea of the Omega Point (a maximum level of complexity and consciousness towards which he believed the universe was evolving) and developed Vladimir Vernadsky's concept of noosphere.
Although many of Teilhard's writings were censored by the Catholic Church during his lifetime because of his views on original sin, Teilhard has been posthumously praised by Pope Benedict XVI and other eminent Catholic figures, and his theological teachings were cited by Pope Francis in the 2015 encyclical, Laudato si'. The response to his writings by evolutionary biologists has been, with some exceptions, decidedly negative."""
274,Hans Kelsen,Modern,"""Hans Kelsen (German: [hans ˈkɛlzən]; October 11, 1881 – April 19, 1973) was an Austrian jurist, legal philosopher and political philosopher. Due to the rise of Nazism in Germany and Austria, Kelsen left his university post because of his Jewish ancestry, and departed to Geneva in 1933, and then to the United States in 1940. In 1934, Roscoe Pound lauded Kelsen as “undoubtedly the leading jurist of the time.” While in Vienna, Kelsen was a young colleague of Sigmund Freud and wrote on the subject of social psychology and sociology.
By the 1940s, Kelsen’s reputation was already well established in the United States for his defense of democracy and for his magnum opus Pure Theory of Law. Kelsen’s academic stature exceeded legal theory alone and extended to political philosophy and social theory as well. His influence encompassed the fields of philosophy, legal science, sociology, the theory of democracy, and international relations.
Late in his career while at the University of California, Berkeley, Kelsen rewrote Pure Theory of Law into a second version. Kelsen throughout his active career was also a significant contributor to the theory of judicial review, the hierarchical and dynamic theory of positive law, and the science of law. In political philosophy he was a defender of the state-law identity theory and an advocate of explicit contrast of the themes of centralization and decentralization in the theory of government. Kelsen was also an advocate of the position of separation of the concepts of state and society in their relation to the study of the science of law.
The reception and criticism of Kelsen's work and contributions has been extensive with both ardent supporters and detractors. Kelsen's contributions to legal theory of the Nuremberg trials was supported and contested by various authors including Dinstein at the Hebrew University in Jerusalem. Kelsen's neo-Kantian defense of continental legal positivism was supported by H. L. A. Hart in its contrasting form of Anglo-American legal positivism, which was debated in its Anglo-American form by scholars such as Ronald Dworkin and Jeremy Waldron."""
275,Moritz Schlick,Modern,"""Friedrich Albert Moritz Schlick (German: [ʃlɪk]; April 14, 1882 – June 22, 1936) was a German philosopher, physicist, and the founding father of logical positivism and the Vienna Circle."""
276,Otto Neurath,Modern,"""Otto Neurath (German: [ˈnɔʏʀaːt]; December 10, 1882 – December 22, 1945) was an Austrian philosopher, philosopher of science, sociologist, and political economist. Before he fled his native country in 1934, Neurath was one of the leading figures of the Vienna Circle."""
277,Nicolai Hartmann,Modern,"""Nicolai Hartmann (German: [ˈhaɐ̯tman]; 20 February 1882 – 9 October 1950) was a Baltic German philosopher. He is regarded as a key representative of critical realism and as one of the most important twentieth century metaphysicians."""
278,Jacques Maritain,Modern,"""Jacques Maritain (18 November 1882 – 28 April 1973) was a French Catholic philosopher. Raised as a Protestant, he became an agnostic before converting to Catholicism in 1906. An author of more than 60 books, he helped to revive St. Thomas Aquinas for modern times, and was influential in the development and drafting of the Universal Declaration of Human Rights. Blessed Pope Paul VI presented his 'Message to Men of Thought and of Science' at the close of Vatican II to Maritain, his long-time friend and mentor. The same pope had seriously considered making him a lay Cardinal, but Maritain rejected it. Maritain's interest and works spanned many aspects of philosophy, including aesthetics, political theory, philosophy of science, metaphysics, the nature of education, liturgy and ecclesiology."""
279,José Ortega y Gasset,Modern,"""José Ortega y Gasset (Spanish: [xoˈse orˈteɣa i ɣaˈset]; 9 May 1883 – 18 October 1955) was a Spanish philosopher, and essayist. He worked during the first half of the 20th century, while Spain oscillated between monarchy, republicanism, and dictatorship. His philosophy has been characterized as a 'philosophy of life' that 'comprised a long-hidden beginning in a pragmatist metaphysics inspired by William James, and with a general method from a realist phenomenology imitating Edmund Husserl, which served both his proto-existentialism (prior to Martin Heidegger's) and his realist historicism, which has been compared to both Wilhelm Dilthey and Benedetto Croce.'

"""
280,Clarence Irving Lewis,Modern,"""Clarence Irving Lewis (April 12, 1883 – February 3, 1964), usually cited as C. I. Lewis, was an American academic philosopher and the founder of conceptual pragmatism. First a noted logician, he later branched into epistemology, and during the last 20 years of his life, he wrote much on ethics. The New York Times memorialized him as 'a leading authority on symbolic logic and on the philosophic concepts of knowledge and value.'"""
281,Gaston Bachelard,Modern,"""Gaston Bachelard (French: [baʃlaʁ]; 27 June 1884 – 16 October 1962) was a French philosopher. He made contributions in the fields of poetics and the philosophy of science. To the latter he introduced the concepts of epistemological obstacle and epistemological break (obstacle épistémologique and rupture épistémologique). He influenced many subsequent French philosophers, among them Michel Foucault, Louis Althusser, Dominique Lecourt and Jacques Derrida, as well as the sociologist Pierre Bourdieu."""
282,Georg Lukács,Modern,"""György Lukács (born as György Bernát Löwinger, ; Hungarian: [ˌɟørɟ ˈlukaːtʃ]; also Georg Lukács; 13 April 1885 – 4 June 1971) was a Hungarian Marxist philosopher, aesthetician, literary historian, and critic. He was one of the founders of Western Marxism, an interpretive tradition that departed from the Marxist ideological orthodoxy of the USSR. He developed the theory of reification, and contributed to Marxist theory with developments of Karl Marx's theory of class consciousness. He was also the philosopher of Leninism. He ideologically developed and organised Lenin's pragmatic revolutionary practices into the formal philosophy of vanguard-party revolution.
As a literary critic Lukács was especially influential, because of his theoretical developments of realism and of the novel as a literary genre. In 1919, he was the Hungarian Minister of Culture of the government of the short-lived Hungarian Soviet Republic (March–August 1919).
Lukács has been described as the preeminent Marxist intellectual of the Stalinist era, though assessing his legacy can be difficult as Lukács seemed to both support Stalinism as the embodiment of Marxist thought, and yet also champion a return to pre-Stalinist Marxism."""
283,Walter Terence Stace,Modern,"""Walter Terence Stace (17 November 1886 – 2 August 1967) was a British civil servant, educator, public philosopher and epistemologist, who wrote on Hegel, mysticism, and moral relativism. He worked with the Ceylon Civil Service from 1910-1932, and from 1932-1955 he was employed by Princeton University in the Department of Philosophy. He is most renowned for his work in the philosophy of mysticism, and for books like Mysticism and Philosophy (1960) and Teachings of the Mystics (1960). These works have been influential in the study of mysticism, but they have also been severely criticised for their lack of methodological rigor and their perennialist pre-assumptions."""
284,Karl Barth,Modern,"""Karl Barth (; German: [baʀt]; (1886-05-10)May 10, 1886 – (1968-12-10)December 10, 1968) was a Swiss Reformed theologian who is often regarded as the greatest Protestant theologian of the twentieth century. His influence expanded well beyond the academic realm to mainstream culture, leading him to be featured on the cover of Time on April 20, 1962.
Beginning with his experience as a pastor, Barth rejected his training in the predominant liberal theology typical of 19th-century European Protestantism. He also rejected more conservative forms of Christianity. Instead he embarked on a new theological path initially called dialectical theology due to its stress on the paradoxical nature of divine truth (e.g., God's relationship to humanity embodies both grace and judgment). Many critics have referred to Barth as the father of neo-orthodoxy – a term that Barth emphatically rejected. A more charitable description of his work might be 'a theology of the Word.' Barth's work had a profound impact on twentieth century theology and figures such as Dietrich Bonhoeffer – who like Barth became a leader in the Confessing Church – Thomas F. Torrance, Reinhold Niebuhr, Jacques Ellul, Stanley Hauerwas, Hans Kung, Jürgen Moltmann, and novelists such as John Updike and Miklós Szentkuthy.
Barth's unease with the dominant theology which characterized Europe led him to become a leader in the Confessing Church in Germany, which actively opposed Adolf Hitler and the Nazi regime. In particular, Barth and other members of the movement vigorously attempted to prevent the Nazis from taking over the existing church and establishing a state church controlled by the regime. This culminated in Barth's authorship of the Barmen Declaration, which fiercely criticized Christians who supported the Nazis.
One of the most prolific and influential theologians of the twentieth century, Barth emphasized the sovereignty of God, particularly through his reinterpretation of the Calvinistic doctrine of election, the sinfulness of humanity, and the 'infinite qualitative distinction between God and mankind'. His most famous works are his The Epistle to the Romans, which marked a clear break from his earlier thinking, and his massive thirteen-volume work Church Dogmatics, one of the largest works of systematic theology ever written."""
285,C. D. Broad,Modern,"""Charlie Dunbar Broad (30 December 1887 – 11 March 1971), usually cited as C. D. Broad, was an English epistemologist, historian of philosophy, philosopher of science, moral philosopher, and writer on the philosophical aspects of psychical research. He was known for his thorough and dispassionate examinations of arguments in such works as Scientific Thought, published in 1923, The Mind and Its Place in Nature, published in 1925, and An Examination of McTaggart's Philosophy, published in 1933.
Broad's essay on 'Determinism, Indeterminism, and Libertarianism' in Ethics and the History of Philosophy (1952) introduced the philosophical terms 'occurrent causation' and 'non-occurrent causation', which became the basis for today's 'agent causal' and 'event causal' distinctions in the debates on libertarian free will.

"""
286,Ludwig Wittgenstein,Modern,"""Ludwig Josef Johann Wittgenstein (; German: [ˈvɪtgənˌʃtaɪn]; 26 April 1889 – 29 April 1951) was an Austrian-British philosopher who worked primarily in logic, the philosophy of mathematics, the philosophy of mind, and the philosophy of language. From 1929 to 1947, Wittgenstein taught at the University of Cambridge. During his lifetime he published just one slim book, the 75-page Tractatus Logico-Philosophicus (1921), one article, one book review and a children's dictionary. His voluminous manuscripts were edited and published posthumously. Philosophical Investigations appeared as a book in 1953, and has since come to be recognised as one of the most important works of philosophy in the twentieth century. His teacher Bertrand Russell described Wittgenstein as 'the most perfect example I have ever known of genius as traditionally conceived; passionate, profound, intense, and dominating'.
Born in Vienna into one of Europe's richest families, he inherited a large fortune from his father in 1913. He initially made some donations to artists and writers and then, in a period of severe personal depression after the First World War, he gave away his entire fortune to his brothers and sisters. Three of his brothers committed suicide, with Wittgenstein contemplating it too. He left academia several times—serving as an officer on the front line during World War I, where he was decorated a number of times for his courage; teaching in schools in remote Austrian villages where he encountered controversy for hitting children when they made mistakes in mathematics; and working as a hospital porter during World War II in London where he told patients not to take the drugs they were prescribed while largely managing to keep secret the fact that he was one of the world's most famous philosophers. He described philosophy as 'the only work that gives me real satisfaction'.
His philosophy is often divided into an early period, exemplified by the Tractatus, and a later period, articulated in the Philosophical Investigations. The early Wittgenstein was concerned with the logical relationship between propositions and the world and believed that by providing an account of the logic underlying this relationship, he had solved all philosophical problems. The later Wittgenstein rejected many of the assumptions of the Tractatus, arguing that the meaning of words is best understood as their use within a given language-game."""
287,Gabriel Marcel,Modern,"""Gabriel Honoré Marcel (French: [ɡa.bʁi.jɛl ɔ.nɔ.ʁe maʁ.sɛl]; 7 December 1889 – 8 October 1973) was a French philosopher, playwright, music critic and leading Christian existentialist. The author of over a dozen books and at least thirty plays, Marcel's work focused on the modern individual's struggle in a technologically dehumanizing society. Though often regarded as the first French existentialist, he dissociated himself from figures such as Jean-Paul Sartre, preferring the term 'Philosophy of Existence' or 'neo-Socrateanism' to define his own thought. The Mystery of Being is a well-known two-volume work authored by Marcel."""
288,Martin Heidegger,Modern,"""Martin Heidegger (; German: [ˈmaɐ̯tiːn ˈhaɪdɛɡɐ]; 26 September 1889 – 26 May 1976) was a German philosopher and a seminal thinker in the Continental tradition and philosophical hermeneutics. According to the Internet Encyclopedia of Philosophy, he is 'widely acknowledged to be one of the most original and important philosophers of the 20th century'. Heidegger is best known for his contributions to phenomenology and existentialism, though as the Stanford Encyclopedia of Philosophy cautions, 'his thinking should be identified as part of such philosophical movements only with extreme care and qualification'.
His first and best known book, Being and Time (1927), though unfinished, is one of the central philosophical works of the 20th century. In the first division of the work, Heidegger attempted to turn away from 'ontic' questions about beings to ontological questions about Being, and recover the most fundamental philosophical question: the question of Being, of what it means for something to be. Heidegger approached the question through an inquiry into the being that has an understanding of Being, and asks the question about it, namely, Human being, which he called Dasein ('being-there'). Heidegger argued that Dasein is defined by Care, its practically engaged and concernful mode of Being-in-the-world, in opposition to Rationalist thinkers like René Descartes who located the essence of man in our thinking abilities. For Heidegger thinking is thinking about things originally discovered in our everyday practical engagements. The consequence of this is that our capacity to think cannot be the most central quality of our being because thinking is a reflecting upon this more original way of discovering the world. In the second division, Heidegger argues that human being is even more fundamentally structured by its Temporality, or its concern with, and relationship to time, existing as a structurally open 'possibility-for-being.' He emphasized the importance of Authenticity in human existence, involving a truthful relationship to our thrownness into a world which we are 'always already' concerned with, and to our Being-towards-death, the Finitude of the time and being we are given, and the closing down of our various possibilities for being through time.
Heidegger also made critical contributions to philosophical conceptions of truth, arguing that its original meaning was unconcealment, to philosophical analyses of art as a site of the revelation of truth, and to philosophical understanding of language as the 'house of being.' Heidegger's later work includes criticisms of technology's instrumentalist understanding in the Western tradition as 'enframing,' treating all of Nature as a 'standing reserve' on call for human purposes. Heidegger is a controversial figure, largely for his affiliation with Nazism, as Rector of the University of Freiburg for 11 months, before his resignation in April 1934, for which he neither apologized nor publicly expressed regret, although in private he called it 'the biggest stupidity of his life' (die größte Dummheit seines Lebens)."""
289,Antonio Gramsci,Modern,"""Antonio Francesco Gramsci (Italian: [anˈtɔːnjo fran'tʃesko ˈɡramʃi],  listen ; 22 January 1891 – 27 April 1937) was an Italian Marxist theorist and politician. He wrote on political theory, sociology and linguistics. He attempted to break from the economic determinism of traditional Marxist thought and so is considered a key neo-Marxist. He was a founding member and one-time leader of the Communist Party of Italy and was imprisoned by Benito Mussolini's Fascist regime.
He wrote more than 30 notebooks and 3,000 pages of history and analysis during his imprisonment. His Prison Notebooks are considered a highly original contribution to 20th century political theory. Gramsci drew insights from varying sources – not only other Marxists but also thinkers such as Niccolò Machiavelli, Vilfredo Pareto, Georges Sorel and Benedetto Croce. The notebooks cover a wide range of topics, including Italian history and nationalism, the French Revolution, Fascism, Fordism, civil society, folklore, religion and high and popular culture.
Gramsci is best known for his theory of cultural hegemony, which describes how the state and ruling capitalist class – the bourgeoisie – use cultural institutions to maintain power in capitalist societies. The bourgeoisie in Gramsci's view develops a hegemonic culture using ideology rather than violence, economic force, or coercion. Hegemonic culture propagates its own values and norms so that they become the 'common sense' values of all and thus maintain the status quo. Hegemonic power is therefore used to maintain consent to the capitalist order, rather than coercive power using force to maintain order. This cultural hegemony is produced and reproduced by the dominant class through the institutions that form the superstructure."""
290,Rudolf Carnap,Modern,"""Rudolf Carnap (; German: [ˈkaɐ̯naːp]; May 18, 1891 – September 14, 1970) was a German-born philosopher who was active in Europe before 1935 and in the United States thereafter. He was a major member of the Vienna Circle and an advocate of logical positivism. He is considered 'one of the giants among twentieth-century philosophers.'"""
