phil_id,name,era,summary
0,Thales of Miletus,Greek,"""Thales of Miletus (; Greek: Θαλῆς (ὁ Μῑλήσιος), Thalēs; c. 624 – c. 546 BC) was a pre-Socratic Greek philosopher, mathematician and astronomer from Miletus in Asia Minor (present-day Milet in Turkey). He was one of the Seven Sages of Greece. Many, most notably Aristotle, regarded him as the first philosopher in the Greek tradition, and he is otherwise historically recognized as the first individual in Western civilization known to have entertained and engaged in scientific philosophy.
Thales is recognized for breaking from the use of mythology to explain the world and the universe, and instead explaining natural objects and phenomena by theories and hypotheses, i.e. science. Almost all the other Pre-Socratic philosophers followed him in explaining nature as deriving from a unity of everything based on the existence of a single ultimate substance, instead of using mythological explanations. Aristotle reported Thales' hypothesis that the originating principle of nature and the nature of matter was a single material substance: water.
In mathematics, Thales used geometry to calculate the heights of pyramids and the distance of ships from the shore. He is the first known individual to use deductive reasoning applied to geometry, by deriving four corollaries to Thales' theorem. He is the first known individual to whom a mathematical discovery has been attributed."""
1,Pherecydes of Syros,Greek,"""Pherecydes of Syros (; Φερεκύδης ὁ Σύριος; fl. 6th century BC) was a Greek thinker from the island of Syros. Pherecydes authored a cosmogony, derived from three divine principles, Zas (Zeus), Cthonie (Earth) and Chronos (Time), known as the 'Pentemychos' (Πεντέμυχος, 'of the five recesses'; sometimes the alternative title 'Heptamychos', 'seven recesses' is given). It formed a bridge between the mythological thought of Hesiod and pre-Socratic philosophy. His work is lost, but it survived into the Hellenistic period and we are informed on part of its content indirectly. Pherecydes was said to have been the first writer to communicate philosophical musings in prose. According to William (ca. 1896), Aristotle regarded him partly a mythological writer and Plutarch, as well as many other writers gave him the title of Theologus."""
2,Anaximander,Greek,"""Anaximander (; Greek: Ἀναξίμανδρος Anaximandros; c. 610 – c. 546 BC) was a pre-Socratic Greek philosopher who lived in Miletus, a city of Ionia (in modern-day Turkey). He belonged to the Milesian school and learned the teachings of his master Thales. He succeeded Thales and became the second master of that school where he counted Anaximenes and, arguably, Pythagoras amongst his pupils.
Little of his life and work is known today. According to available historical documents, he is the first philosopher known to have written down his studies, although only one fragment of his work remains. Fragmentary testimonies found in documents after his death provide a portrait of the man.
He was an early proponent of science and tried to observe and explain different aspects of the universe, with a particular interest in its origins, claiming that nature is ruled by laws, just like human societies, and anything that disturbs the balance of nature does not last long. Like many thinkers of his time, Anaximander's philosophy included contributions to many disciplines. In astronomy, he attempted to describe the mechanics of celestial bodies in relation to the Earth. In physics, his postulation that the indefinite (or apeiron) was the source of all things led Greek philosophy to a new level of conceptual abstraction. His knowledge of geometry allowed him to introduce the gnomon in Greece. He created a map of the world that contributed greatly to the advancement of geography. He was also involved in the politics of Miletus and was sent as a leader to one of its colonies.

"""
3,Anaximenes of Miletus,Greek,"""Anaximenes of Miletus (; Greek: Ἀναξιμένης ὁ Μιλήσιος; c. 585 – c. 528 BCE) was an Ancient Greek Pre-Socratic philosopher active in the latter half of the 6th century BC. One of the three Milesian philosophers, he is identified as a younger friend or student of Anaximander. Anaximenes, like others in his school of thought, practiced material monism. This tendency to identify one specific underlying reality made up of a material thing is what Anaximenes is principally known for today."""
4,Pythagoras,Greek,"""Pythagoras of Samos (US: ; UK: ; Greek: Πυθαγόρας ὁ Σάμιος Pythagóras ho Sámios 'Pythagoras the Samian', or simply Πυθαγόρας; Πυθαγόρης in Ionian Greek; c. 570–495 BC) was an Ionian Greek philosopher, mathematician, and putative founder of the Pythagoreanism movement. He is often revered as a great mathematician and scientist and is best known for the Pythagorean theorem which bears his name.
Legend and obfuscation cloud his work, so it is uncertain whether he truly contributed much to mathematics or natural philosophy. Many of the accomplishments credited to Pythagoras may actually have been accomplishments of his colleagues or successors. Some accounts mention that the philosophy associated with Pythagoras was related to mathematics and that numbers were important. It was said that he was the first man to call himself a philosopher, or lover of wisdom, and Pythagorean ideas exercised a marked influence on Plato, and through him, all of Western philosophy."""
5,Xenophanes,Greek,"""Xenophanes of Colophon (; Ancient Greek: Ξενοφάνης ὁ Κολοφώνιος [ksenopʰánɛːs ho kolopʰɔ̌ːnios]; c. 570 – c. 475 BC) was a Greek philosopher, theologian, poet, and social and religious critic. Xenophanes lived a life of travel, having left Ionia at the age of 25 and continuing to travel throughout the Greek world for another 67 years. Some scholars say he lived in exile in Sicily. Knowledge of his views comes from fragments of his poetry, surviving as quotations by later Greek writers. To judge from these, his elegiac and iambic poetry criticized and satirized a wide range of ideas, including Homer and Hesiod, the belief in the pantheon of anthropomorphic gods and the Greeks' veneration of athleticism. He is the earliest Greek poet who claims explicitly to be writing for future generations, creating 'fame that will reach all of Greece, and never die while the Greek kind of songs survives.'"""
6,Epicharmus of Kos,Greek,"""Epicharmus of Kos or Epicharmus Comicus or Epicharmus Comicus Syracusanus (Greek: Ἐπίχαρμος ὁ Κῷος), thought to have lived between c. 540 and c. 450 BC, was a Greek dramatist and philosopher often credited with being one of the first comic writers, having originated the Doric or Sicilian comedic form. Aristotle (Poetics 5.1449b5) writes that he and Phormis invented comic plots (μῦθοι, muthoi). Most of the information we have about Epicharmus comes from the writings of Athenaeus, Suda and Diogenes Laertius, but fragments and comments come up in a host of other ancient authors as well. There have also been some papyrus finds of longer sections of text, but these are often so full of holes that it is difficult to make sense of them. Plato mentions Epicharmus in his dialogue Gorgias and in Theaetetus. In the latter, Socrates refers to Epicharmus as 'the prince of Comedy', Homer as 'the prince of Tragedy', and both as 'great masters of either kind of poetry'. More references by ancient authors can be found discussed in Pickard-Cambridge's Dithyramb, Tragedy, Comedy and they are collected in Greek in Kassel and Austin's new edition of the fragments in Poetae Comici Graeci (2001)."""
7,Heraclitus,Greek,"""Heraclitus of Ephesus (; Greek: Ἡράκλειτος ὁ Ἐφέσιος, Hērákleitos ho Ephésios; c. 535 – c. 475 BC) was a pre-Socratic Greek philosopher, and a native of the city of Ephesus, then part of the Persian Empire. He was of distinguished parentage. Little is known about his early life and education, but he regarded himself as self-taught and a pioneer of wisdom. From the lonely life he led, and still more from the apparently riddled and allegedly paradoxical nature of his philosophy and his stress upon the needless unconsciousness of humankind, he was called 'The Obscure' and the 'Weeping Philosopher'.
Heraclitus was famous for his insistence on ever-present change as being the fundamental essence of the universe, as stated in the famous saying, 'No man ever steps in the same river twice' (see panta rhei, below). This position was complemented by his stark commitment to a unity of opposites in the world, stating that 'the path up and down are one and the same'. Through these doctrines Heraclitus characterized all existing entities by pairs of contrary properties, whereby no entity may ever occupy a single state at a single time. This, along with his cryptic utterance that 'all entities come to be in accordance with this Logos' (literally, 'word', 'reason', or 'account') has been the subject of numerous interpretations."""
8,Parmenides,Greek,"""Parmenides of Elea (; Greek: Παρμενίδης ὁ Ἐλεάτης; fl. late sixth or early fifth century BC) was a pre-Socratic Greek philosopher from Elea in Magna Graecia (Greater Greece, included Southern Italy). He was the founder of the Eleatic school of philosophy. The single known work of Parmenides is a poem, On Nature, which has survived only in fragmentary form. In this poem, Parmenides describes two views of reality. In 'the way of truth' (a part of the poem), he explains how reality (coined as 'what-is') is one, change is impossible, and existence is timeless, uniform, necessary, and unchanging. In 'the way of opinion', he explains the world of appearances, in which one's sensory faculties lead to conceptions which are false and deceitful."""
9,Anaxagoras,Greek,"""Anaxagoras (; Greek: Ἀναξαγόρας, Anaxagoras, 'lord of the assembly'; c. 510 – c. 428 BC) was a Pre-Socratic Greek philosopher. Born in Clazomenae in the Persian Empire (modern-day Urla, Turkey) Anaxagoras was the first to bring philosophy to Athens. According to Diogenes Laertius and Plutarch, in later life he was charged with impiety and went into exile in Lampsacus; the charges may have been political, owing to his association with Pericles, if they were not fabricated by later ancient biographers.
Responding to the claims of Parmenides on the impossibility of change, Anaxagoras described the world as a mixture of primary imperishable ingredients, where material variation was never caused by an absolute presence of a particular ingredient, but rather by its relative preponderance over the other ingredients; in his words, 'each one is... most manifestly those things of which there are the most in it'. He introduced the concept of Nous (Mind) as an ordering force, which moved and separated out the original mixture, which was homogeneous, or nearly so.
He also gave a number of novel scientific accounts of natural phenomena. He produced a correct explanation for eclipses and described the sun as a fiery mass larger than the Peloponnese, as well as attempting to explain rainbows and meteors."""
10,Empedocles,Greek,"""Empedocles (; Greek: Ἐμπεδοκλῆς [empedoklɛ̂ːs], Empedoklēs; c. 490 – c. 430 BC) was a Greek pre-Socratic philosopher and a citizen of Acragas (Agrigentum), a Greek city in Sicily. Empedocles' philosophy is best known for originating the cosmogenic theory of the four classical elements. He also proposed forces he called Love and Strife which would mix as well as separate the elements. These physical speculations were part of a history of the universe which also dealt with the origin and development of life.
Influenced by the Pythagoreans, Empedocles was a vegetarian who supported the doctrine of reincarnation. He is generally considered the last Greek philosopher to have recorded his ideas in verse. Some of his work survives, more than is the case for any other pre-Socratic philosopher. Empedocles' death was mythologized by ancient writers, and has been the subject of a number of literary treatments."""
11,Zeno of Elea,Greek,"""Zeno of Elea (; Greek: Ζήνων ὁ Ἐλεάτης; c. 490 – c. 430 BC) was a pre-Socratic Greek philosopher of Magna Graecia and a member of the Eleatic School founded by Parmenides. Aristotle called him the inventor of the dialectic. He is best known for his paradoxes, which Bertrand Russell has described as 'immeasurably subtle and profound.'

"""
12,Protagoras,Greek,"""Protagoras (; Greek: Πρωταγόρας; c. 490 – c. 420 BC) was a pre-Socratic Greek philosopher and is numbered as one of the sophists by Plato. In his dialogue, Protagoras, Plato credits him with having invented the role of the professional sophist.
He also is believed to have created a major controversy during ancient times through his statement that, 'Man is the measure of all things', interpreted by Plato to mean that there is no absolute truth, but that which individuals deem to be the truth. Although there is reason to question the extent of the interpretation of his arguments that has followed, that concept of individual relativity was revolutionary for the time, and contrasted with other philosophical doctrines that claimed the universe was based on something objective, outside of human influence or perceptions."""
13,Sophistic works of Antiphon,Greek,"""The name Antiphon the Sophist (; Greek: Ἀντιφῶν) is used to refer to the writer of several Sophistic treatises. He probably lived in Athens in the last two decades of the 5th century BC, but almost nothing is known of his life.
It has been debated since antiquity whether the writer of these Sophistic treatises was in fact none other than Antiphon the Orator, or whether Antiphon the Sophist was indeed a separate person. This remains an active scholarly controversy; of recent editors, Gagarin, and Laks and Most, believe there to be only one Antiphon, whereas G.J. Pendrick argues for the existence of two separate individuals.
The most important of these treatises was On Truth, whose surviving fragments cover many different subjects, from astronomy and mathematics to morality and ethics. Fragments have also been preserved of the treatises On Concord and Politicus; these fragments have sometimes been attributed to the Orator rather than to the Sophist.
It is also not known for certain whether the treatise on the Interpretation of Dreams under the name of Antiphon was written by Antiphon the Sophist, or whether this was written by yet another different Antiphon. The editions of Pendrick and of Laks and Most proceed on the basis that this treatise was written by the same Antiphon as the Sophistic works."""
14,Hippias,Greek,"""Hippias of Elis (; Greek: Ἱππίας ὁ Ἠλεῖος; late 5th century BC) was a Greek sophist, and a contemporary of Socrates. With an assurance characteristic of the later sophists, he claimed to be regarded as an authority on all subjects, and lectured on poetry, grammar, history, politics, mathematics, and much else. Most of our knowledge of him is derived from Plato, who characterizes him as vain and arrogant.

"""
15,Gorgias,Greek,"""Gorgias (; Greek: Γοργίας Ancient Greek: [ɡorɡíaːs]; c. 485 – c. 380 BC) was a Greek sophist, Siceliote, pre-Socratic philosopher and rhetorician who was a native of Leontini in Sicily. Along with Protagoras, he forms the first generation of Sophists. Several doxographers report that he was a pupil of Empedocles, although he would only have been a few years younger. 'Like other Sophists he was an itinerant, practicing in various cities and giving public exhibitions of his skill at the great pan-Hellenic centers of Olympia and Delphi, and charged fees for his instruction and performances. A special feature of his displays was to invite miscellaneous questions from the audience and give impromptu replies.' He has been called 'Gorgias the Nihilist' although the degree to which this epithet adequately describes his philosophy is controversial.
His chief claim to recognition is that he transplanted rhetoric from his native Sicily to Attica, and contributed to the diffusion of the Attic dialect as the language of literary prose."""
16,Socrates,Greek,"""Socrates (; Greek: Σωκράτης [sɔːkrátɛːs], Sōkrátēs; 470/469 – 399 BC) was a classical Greek (Athenian) philosopher credited as one of the founders of Western philosophy. He is an enigmatic figure known chiefly through the accounts of classical writers, especially the writings of his students Plato and Xenophon and the plays of his contemporary Aristophanes. Plato's dialogues are among the most comprehensive accounts of Socrates to survive from antiquity, though it is unclear the degree to which Socrates himself is 'hidden behind his 'best disciple', Plato'.
Through his portrayal in Plato's dialogues, Socrates has become renowned for his contribution to the field of ethics, and it is this Platonic Socrates who lends his name to the concepts of Socratic irony and the Socratic method, or elenchus. The latter remains a commonly used tool in a wide range of discussions, and is a type of pedagogy in which a series of questions is asked not only to draw individual answers, but also to encourage fundamental insight into the issue at hand. Plato's Socrates also made important and lasting contributions to the field of epistemology, and his ideologies and approach have proven a strong foundation for much Western philosophy that has followed."""
17,Critias,Greek,"""Critias (; Greek: Κριτίας, Kritias; c. 460 – 403 BCE) was an ancient Athenian political figure and author. Born in Athens, Critias was the son of Callaeschrus and a first cousin of Plato's mother Perictione. He became a leading and violent member of the Thirty Tyrants. He also was an associate of Socrates, a fact that did not endear Socrates to the Athenian public.
Critias was noted in his day for his tragedies, elegies and prose works. Some, like Sextus Empiricus, believe that Critias wrote the Sisyphus fragment; others, however, attribute it to Euripides. His only known play is Peirithous, of which only a single 42-line fragment survives (Sextus Empir. p. 403, 1). In addition, eight shorter quotations from unidentified plays have come down to us.

"""
18,Prodicus,Greek,"""Prodicus of Ceos (; Greek: Πρόδικος ὁ Κεῖος, Pródikos ho Keios; c. 465 BC – c. 395 BC) was a Greek philosopher, and part of the first generation of Sophists. He came to Athens as ambassador from Ceos, and became known as a speaker and a teacher. Plato treats him with greater respect than the other sophists, and in several of the Platonic dialogues Socrates appears as the friend of Prodicus. One writer claims Socrates used his method of instruction. Prodicus made linguistics and ethics prominent in his curriculum. The content of one of his speeches is still known, and concerns a fable in which Heracles has to make a choice between Virtue and Vice. He also interpreted religion through the framework of naturalism."""
19,Leucippus,Greek,"""Leucippus (; Greek: Λεύκιππος, Leúkippos; fl. 5th cent. BCE) is reported in some ancient sources to have been a philosopher who was the earliest Greek to develop the theory of atomism—the idea that everything is composed entirely of various imperishable, indivisible elements called atoms. Leucippus often appears as the master to his pupil Democritus, a philosopher also touted as the originator of the atomic theory. However, a brief notice in Diogenes Laertius’s life of Epicurus says that on the testimony of Epicurus, Leucippus never existed. As the philosophical heir of Democritus, Epicurus's word has some weight, and indeed a controversy over this matter raged in German scholarship for many years at the close of the 19th century. Furthermore, in his Corpus Democriteum, Thrasyllus of Alexandria, an astrologer and writer living under the emperor Tiberius (14–37 CE), compiled a list of writings on atomism that he attributed to Democritus to the exclusion of Leucippus. The present consensus among the world's historians of philosophy is that this Leucippus is historical. The matter must remain moot unless more information is forthcoming from the record.
Leucippus was most likely born in Miletus, although Abdera and Elea are also mentioned as possible birthplaces."""
20,Thrasymachus,Greek,"""Thrasymachus (; Greek: Θρασύμαχος Thrasýmachos; c. 459 – c. 400 BC) was a sophist of Ancient Greece best known as a character in Plato's Republic."""
21,Democritus,Greek,"""Democritus (; Greek: Δημόκριτος, Dēmókritos, meaning 'chosen of the people'; c. 460 – c. 370 BC) was an influential Ancient Greek pre-Socratic philosopher primarily remembered today for his formulation of an atomic theory of the universe.
Democritus was born in Abdera, Thrace, around 460 BC, although, some thought it was 490 BC. His exact contributions are difficult to disentangle from those of his mentor Leucippus, as they are often mentioned together in texts. Their speculation on atoms, taken from Leucippus, bears a passing and partial resemblance to the 19th-century understanding of atomic structure that has led some to regard Democritus as more of a scientist than other Greek philosophers; however, their ideas rested on very different bases. Largely ignored in ancient Athens, Democritus is said to have been disliked so much by Plato that the latter wished all of his books burned. He was nevertheless well known to his fellow northern-born philosopher Aristotle. Many consider Democritus to be the 'father of modern science'. None of his writings have survived; only fragments are known from his vast body of work."""
22,Diagoras of Melos,Greek,"""Diagoras 'the Atheist' of Melos (Greek: Διαγόρας ὁ Μήλιος) was a Greek poet and sophist of the 5th century BC. Throughout Antiquity he was regarded as an atheist. With the exception of this one point, there is little information concerning his life and beliefs. He spoke out against the Greek religion, and criticized the Eleusinian Mysteries. The Athenians accused him of impiety, and he was forced to flee the city. He died in Corinth."""
23,Antisthenes,Greek,"""Antisthenes (; Greek: Ἀντισθένης; c. 445 – c. 365 BC) was a Greek philosopher and a pupil of Socrates. Antisthenes first learned rhetoric under Gorgias before becoming an ardent disciple of Socrates. He adopted and developed the ethical side of Socrates' teachings, advocating an ascetic life lived in accordance with virtue. Later writers regarded him as the founder of Cynic philosophy."""
24,Aristippus,Greek,"""Aristippus of Cyrene (; Greek: Ἀρίστιππος ὁ Κυρηναῖος; c. 435 – c. 356 BCE) was the founder of the Cyrenaic school of Philosophy. He was a pupil of Socrates, but adopted a very different philosophical outlook, teaching that the goal of life was to seek pleasure by adapting circumstances to oneself and by maintaining proper control over both adversity and prosperity. Among his pupils was his daughter Arete.
There are indications that he was conflated with his grandson, Aristippus the Younger."""
25,Alcidamas,Greek,"""Alcidamas (Greek: Ἀλκιδάμας), of Elaea, in Aeolis, Greek sophist and rhetorician, flourished in the 4th century BC."""
