phil_id,name,era,summary
185,Jean-Baptiste Lamarck,Modern,"""Jean-Baptiste Pierre Antoine de Monet, Chevalier de Lamarck (1 August 1744 – 18 December 1829), often known simply as Lamarck (; French: [lamaʁk]), was a French naturalist. He was a soldier, biologist, academic, and an early proponent of the idea that biological evolution occurred and proceeded in accordance with natural laws.
Lamarck fought in the Pomeranian War (1757–62) against Prussia, and was awarded a commission for bravery on the battlefield. Posted to Monaco, Lamarck became interested in natural history and resolved to study medicine. He retired from the army after being injured in 1766, and returned to his medical studies. Lamarck developed a particular interest in botany, and later, after he published the three-volume work Flore françoise (1778), he gained membership of the French Academy of Sciences in 1779. Lamarck became involved in the Jardin des Plantes and was appointed to the Chair of Botany in 1788. When the French National Assembly founded the Muséum national d'Histoire naturelle in 1793, Lamarck became a professor of zoology.
In 1801, he published Système des animaux sans vertèbres, a major work on the classification of invertebrates, a term he coined. In an 1802 publication he became one of the first to use the term biology in its modern sense. Lamarck continued his work as a premier authority on invertebrate zoology. He is remembered, at least in malacology, as a taxonomist of considerable stature.
The modern era generally remembers Lamarck for a theory of inheritance of acquired characteristics, called soft inheritance, Lamarckism or use/disuse theory, which he described in his 1809 Philosophie Zoologique. However, his idea of soft inheritance was, perhaps, a reflection of the wisdom of the time accepted by many natural historians. Lamarck's contribution to evolutionary theory consisted of the first truly cohesive theory of biological evolution, in which an alchemical complexifying force drove organisms up a ladder of complexity, and a second environmental force adapted them to local environments through use and disuse of characteristics, differentiating them from other organisms. Scientists have debated whether advances in the field of transgenerational epigenetics mean that Lamarck was to an extent correct, or not."""
186,Pierre-Simon Laplace,Modern,"""Pierre-Simon, marquis de Laplace (; French: [pjɛʁ simɔ̃ laplas]; 23 March 1749 – 5 March 1827) was an influential French scholar whose work was important to the development of mathematics, statistics, physics and astronomy. He summarised and extended the work of his predecessors in his five-volume Mécanique Céleste (Celestial Mechanics) (1799–1825). This work translated the geometric study of classical mechanics to one based on calculus, opening up a broader range of problems. In statistics, the Bayesian interpretation of probability was developed mainly by Laplace.
Laplace formulated Laplace's equation, and pioneered the Laplace transform which appears in many branches of mathematical physics, a field that he took a leading role in forming. The Laplacian differential operator, widely used in mathematics, is also named after him. He restated and developed the nebular hypothesis of the origin of the Solar System and was one of the first scientists to postulate the existence of black holes and the notion of gravitational collapse.
Laplace is remembered as one of the greatest scientists of all time. Sometimes referred to as the French Newton or Newton of France, he has been described as possessing a phenomenal natural mathematical faculty superior to that of any of his contemporaries. He was Napoleon's examiner when Napoleon attended the Ecole Militaire in Paris in 1784. Laplace became a count of the Empire in 1806 and was named a marquis in 1817, after the Bourbon Restoration."""
187,Joseph de Maistre,Modern,"""Joseph-Marie, comte de Maistre (French: [də mɛstʁ]; 1 April 1753 – 26 February 1821) was a French-speaking Savoyard philosopher, writer, lawyer, and diplomat, who advocated social hierarchy and monarchy in the period immediately following the French Revolution. Despite his close personal and intellectual ties with France, Maistre was throughout his life a subject of the King of Piedmont-Sardinia, whom he served as member of the Savoy Senate (1787–1792), ambassador to Russia (1803–1817), and minister of state to the court in Turin (1817–1821).
A key figure of the 'Counter-Enlightenment', Maistre regarded monarchy as both a divinely sanctioned institution and as the only stable form of government. He called for the restoration of the House of Bourbon to the throne of France and for the ultimate authority of the Pope in temporal matters. Maistre argued that the rationalist rejection of Christianity was directly responsible for the disorder and bloodshed which followed the French Revolution of 1789."""
188,"Claude Henri de Rouvroy, comte de Saint-Simon",Modern,"""Claude Henri de Rouvroy, comte de Saint-Simon, often referred to as Henri de Saint-Simon (French: [sɛ̃ simɔ̃]; 17 October 1760 – 19 May 1825), was a French political and economic theorist and businessman whose thought played a substantial role in influencing politics, economics, sociology, and the philosophy of science.
He created a political and economic ideology known as industrialism that claimed that the needs of an industrial class, which he also referred to as the working class, needed to be recognized and fulfilled to have an effective society and an efficient economy. Unlike later conceptions by others of a working class being manual labourers alone, Saint-Simon's conception of this class included all people engaged in productive work that contributed to society, that included businesspeople, managers, scientists, bankers, along with manual labourers amongst others. He said the primary threat to the needs of the industrial class was another class he referred to as the idling class, that included able people who preferred to be parasitic and benefit from the work of others while seeking to avoid doing work. Saint-Simon stressed the need for recognition of the merit of the individual and the need for hierarchy of merit in society and in the economy, such as society having hierarchical merit-based organizations of managers and scientists to be the decision-makers in government. He strongly criticized any expansion of government intervention into the economy beyond ensuring no hindrances to productive work and reducing idleness in society, regarding intervention beyond these as too intrusive.
This ideology soon inspired and influenced utopian socialism, liberal political theorist John Stuart Mill, anarchism through its founder Pierre-Joseph Proudhon who was inspired by Saint-Simon's thought and Marxism with Karl Marx and Friedrich Engels identifying Saint-Simon as an inspiration to their ideas and identifying him among the utopian socialists. However historian Alan Ryan regards certain followers of Saint-Simon, rather than Saint-Simon himself, as being responsible for the rise of utopian socialism that based itself upon Saint-Simon's ideas. He also regards strong differences as existing between Saint-Simon's conceptions and Marxism's as Saint-Simon did not promote class conflict as a solution to societal problems nor did he adhere to the narrower definition of the working class as manual labourers as defined by Marxists. Saint-Simon unlike Marx did not regard the prevalent form of ownership as being paramount issue in the economy but rather the form of management. Furthermore, Saint-Simon held no opposition to capitalists as a whole unlike Marx and he regarded them as an important component of the industrial class. Later Saint-Simon's views influenced sociologist and economist Thorstein Veblen, including Veblen's creation of institutional economics that has included prominent economists as adherents. Historian Alan Ryan states that by the 1950s it was clear that Saint-Simon had invented the modern understanding of industrial society and its organization.
Saint-Simon and his secretary Auguste Comte developed what Comte would complete as sociology."""
189,Germaine de Staël,Modern,"""Anne Louise Germaine de Staël-Holstein (French: [stal]; née Necker; 22 April 1766 – 14 July 1817), commonly known as Madame de Staël, was a French woman of letters of Swiss origin whose lifetime overlapped with the events of the French Revolution and the Napoleonic era. She was one of Napoleon's principal opponents. Celebrated for her conversational eloquence, she participated actively in the political and intellectual life of her times. Her works, both critical and fictional, made their mark on the history of European Romanticism."""
190,Friedrich Schleiermacher,Modern,"""Friedrich Daniel Ernst Schleiermacher (German: [ˈʃlaɪɐˌmaχɐ]; November 21, 1768 – February 12, 1834) was a German theologian, philosopher, and biblical scholar known for his attempt to reconcile the criticisms of the Enlightenment with traditional Protestant Christianity. He also became influential in the evolution of Higher Criticism, and his work forms part of the foundation of the modern field of hermeneutics. Because of his profound effect on subsequent Christian thought, he is often called the 'Father of Modern Liberal Theology' and is considered an early leader in liberal Christianity. The Neo-Orthodoxy movement of the twentieth century, typically (though not without challenge) seen to be spearheaded by Karl Barth, was in many ways an attempt to challenge his influence."""
191,Georg Wilhelm Friedrich Hegel,Modern,"""Georg Wilhelm Friedrich Hegel (; German: [ˈɡeːɔɐ̯k ˈvɪlhɛlm ˈfʁiːdʁɪç ˈheːɡəl]; August 27, 1770 – November 14, 1831) was a German philosopher and an important figure of German idealism. He achieved wide renown in his day and, while primarily influential within the continental tradition of philosophy, has become increasingly influential in the analytic tradition as well. Although Hegel remains a divisive figure, his canonical stature within Western philosophy is universally recognized.
Hegel's principal achievement is his development of a distinctive articulation of idealism sometimes termed 'absolute idealism', in which the dualisms of, for instance, mind and nature and subject and object are overcome. His philosophy of spirit conceptually integrates psychology, the state, history, art, religion, and philosophy. His account of the master–slave dialectic has been highly influential, especially in 20th-century France. Of special importance is his concept of spirit (Geist: sometimes also translated as 'mind') as the historical manifestation of the logical concept and the 'sublation' (Aufhebung: integration without elimination or reduction) of seemingly contradictory or opposing factors; examples include the apparent opposition between nature and freedom and between immanence and transcendence. Hegel has been seen in the 20th century as the originator of the thesis, antithesis, synthesis triad; however, as an explicit phrase, it originated with Johann Gottlieb Fichte.
Hegel has influenced many thinkers and writers whose own positions vary widely. Karl Barth described Hegel as a 'Protestant Aquinas', while Maurice Merleau-Ponty wrote that 'all the great philosophical ideas of the past century—the philosophies of Marx and Nietzsche, phenomenology, German existentialism, and psychoanalysis—had their beginnings in Hegel.'"""
192,James Mill,Modern,"""James Mill (born James Milne, 6 April 1773 – 23 June 1836) was a British historian, economist, political theorist, and philosopher. He is counted among the founders of Ricardian school and was the father of John Stuart Mill, the philosopher of liberalism. His influential History of British India contains a complete denunciation and rejection of Indian culture and civilisation. He divided Indian history into three parts: Hindu, Muslim and British."""
193,Friedrich Wilhelm Joseph Schelling,Modern,"""Friedrich Wilhelm Joseph Schelling (German: [ˈʃɛlɪŋ]; 27 January 1775 – 20 August 1854), later (after 1812) von Schelling, was a German philosopher. Standard histories of philosophy make him the midpoint in the development of German idealism, situating him between Johann Gottlieb Fichte, his mentor in his early years, and Georg Wilhelm Friedrich Hegel, his former university roommate, early friend, and later rival. Interpreting Schelling's philosophy is regarded as difficult because of its apparently ever-changing nature.
Schelling's thought in the large has been neglected, especially in the English-speaking world, as has been his later work on mythology and revelation, much of which remains untranslated. An important factor was the ascendancy of Hegel, whose mature works portray Schelling as a mere footnote in the development of idealism. Schelling's Naturphilosophie also has been attacked by scientists for its analogizing tendency and lack of empirical orientation. However, some later philosophers such as Martin Heidegger and Slavoj Žižek have shown interest in re-examining Schelling's body of work."""
194,Bernard Bolzano,Modern,"""Bernard Bolzano (; German: [bɔlˈtsaːno]; born Bernardus Placidus Johann Gonzal Nepomuk Bolzano; 5 October 1781 – 18 December 1848) was a Bohemian mathematician, logician, philosopher, theologian and Catholic priest of Italian extraction, also known for his antimilitarist views.
Bolzano wrote in German, his mother tongue. For the most part, his work came to prominence posthumously."""
195,Richard Whately,Modern,"""Richard Whately (1 February 1787 – 8 October 1863) was an English rhetorician, logician, economist, academic and theologian who also served as a reforming Church of Ireland Archbishop of Dublin. He was a leading Broad Churchman, a prolific and combative author over a wide range of topics, a flamboyant character, and one of the first reviewers to recognise the talents of Jane Austen."""
196,Arthur Schopenhauer,Modern,"""Arthur Schopenhauer (; German: [ˈaɐ̯tʊɐ̯ ˈʃoːpm̩ˌhaʊ̯ɐ]; 22 February 1788 – 21 September 1860) was a German philosopher. He is best known for his 1818 work The World as Will and Representation (expanded in 1844), wherein he characterizes the phenomenal world as the product of a blind and insatiable metaphysical will. Proceeding from the transcendental idealism of Immanuel Kant, Schopenhauer developed an atheistic metaphysical and ethical system that has been described as an exemplary manifestation of philosophical pessimism, rejecting the contemporaneous post-Kantian philosophies of German idealism. Schopenhauer was among the first thinkers in Western philosophy to share and affirm significant tenets of Eastern philosophy (e.g., asceticism, the world-as-appearance), having initially arrived at similar conclusions as the result of his own philosophical work.
Though his work failed to garner substantial attention during his life, Schopenhauer has had a posthumous impact across various disciplines, including philosophy, literature, and science. His writing on aesthetics, morality, and psychology would exert important influence on thinkers and artists throughout the 19th and 20th centuries. Those who have cited his influence include Friedrich Nietzsche, Richard Wagner, Leo Tolstoy, Ludwig Wittgenstein, Erwin Schrödinger, Otto Rank, Gustav Mahler, Joseph Campbell, Albert Einstein, Carl Jung, Thomas Mann, Emile Zola, George Bernard Shaw, Guy de Maupassant, Jorge Luis Borges and Samuel Beckett."""
197,John Austin (legal philosopher),Modern,"""John Austin (3 March 1790, Creeting St Mary, Suffolk – 1 December 1859, Weybridge, Surrey) was a noted English legal theorist who strongly influenced British and American law with his analytical approach to jurisprudence and his theory of legal positivism. In opposing traditional 'natural-law' approaches, Austin argued against any necessary connections between law and morality. Human legal systems, he claimed, can and should be studied in an empirical, value-free way."""
198,William Whewell,Modern,"""William Whewell  ( HEW-əl; 24 May 1794 – 6 March 1866) was an English polymath, scientist, Anglican priest, philosopher, theologian, and historian of science. He was Master of Trinity College, Cambridge. In his time as a student there, he achieved distinction in both poetry and mathematics.
What is most often remarked about Whewell is the breadth of his endeavours. In a time of increasing specialisation, Whewell appears as a vestige of an earlier era when natural philosophers dabbled in a bit of everything. He researched ocean tides (for which he won the Royal Medal), published work in the disciplines of mechanics, physics, geology, astronomy, and economics, while also finding the time to compose poetry, author a Bridgewater Treatise, translate the works of Goethe, and write sermons and theological tracts. In mathematics, Whewell introduced what is now called the Whewell equation, an equation defining the shape of a curve without reference to an arbitrarily chosen coordinate system.
One of Whewell's greatest gifts to science was his wordsmithing. He often corresponded with many in his field and helped them come up with new terms for their discoveries. Whewell contributed the terms scientist, physicist, linguistics, consilience, catastrophism, and uniformitarianism, amongst others; Whewell suggested the terms ion, dielectric, anode, and cathode to Michael Faraday.
Whewell died in Cambridge in 1866 as a result of a fall from his horse."""
199,Auguste Comte,Modern,"""Isidore Marie Auguste François Xavier Comte (French pronunciation: ​[oɡyst kɔ̃t]; 19 January 1798 – 5 September 1857) was a French philosopher who founded the discipline of praxeology and the doctrine of positivism. He is sometimes regarded as the first philosopher of science in the modern sense of the term.
Influenced by the utopian socialist Henri Saint-Simon, Comte developed the positive philosophy in an attempt to remedy the social malaise of the French Revolution, calling for a new social doctrine based on the sciences. Comte was a major influence on 19th-century thought, influencing the work of social thinkers such as Karl Marx, John Stuart Mill, and George Eliot. His concept of sociologie and social evolutionism set the tone for early social theorists and anthropologists such as Harriet Martineau and Herbert Spencer, evolving into modern academic sociology presented by Émile Durkheim as practical and objective social research.
Comte's social theories culminated in his 'Religion of Humanity', which presaged the development of non-theistic religious humanist and secular humanist organizations in the 19th century. Comte may have coined the word altruisme (altruism)."""
200,Ralph Waldo Emerson,Modern,"""Ralph Waldo Emerson (May 25, 1803 – April 27, 1882) was an American essayist, lecturer, and poet who led the transcendentalist movement of the mid-19th century. He was seen as a champion of individualism and a prescient critic of the countervailing pressures of society, and he disseminated his thoughts through dozens of published essays and more than 1,500 public lectures across the United States.
Emerson gradually moved away from the religious and social beliefs of his contemporaries, formulating and expressing the philosophy of transcendentalism in his 1836 essay 'Nature'. Following this work, he gave a speech entitled 'The American Scholar' in 1837, which Oliver Wendell Holmes Sr. considered to be America's 'intellectual Declaration of Independence'.
Emerson wrote most of his important essays as lectures first and then revised them for print. His first two collections of essays, Essays: First Series (1841) and Essays: Second Series (1844), represent the core of his thinking. They include the well-known essays 'Self-Reliance', 'The Over-Soul', 'Circles', 'The Poet' and 'Experience'. Together with 'Nature', these essays made the decade from the mid-1830s to the mid-1840s Emerson's most fertile period.
Emerson wrote on a number of subjects, never espousing fixed philosophical tenets, but developing certain ideas such as individuality, freedom, the ability for mankind to realize almost anything, and the relationship between the soul and the surrounding world. Emerson's 'nature' was more philosophical than naturalistic: 'Philosophically considered, the universe is composed of Nature and the Soul'. Emerson is one of several figures who 'took a more pantheist or pandeist approach by rejecting views of God as separate from the world.'
He remains among the linchpins of the American romantic movement, and his work has greatly influenced the thinkers, writers and poets that followed him. When asked to sum up his work, he said his central doctrine was 'the infinitude of the private man.' Emerson is also well known as a mentor and friend of Henry David Thoreau, a fellow transcendentalist."""
201,Ludwig Feuerbach,Modern,"""Ludwig Andreas von Feuerbach (28 July 1804 – 13 September 1872) was a German philosopher and anthropologist best known for his book The Essence of Christianity, which provided a critique of Christianity which strongly influenced generations of later thinkers, including Karl Marx and Friedrich Engels.
An associate of Left Hegelian circles, Feuerbach advocated liberalism, atheism, and materialism. Many of his philosophical writings offered a critical analysis of religion. His thought was influential in the development of historical materialism, where he is often recognized as a bridge between Hegel and Marx."""
202,Alexis de Tocqueville,Modern,"""Alexis Charles Henri Clérel, Viscount de Tocqueville (; French: [alɛgzi ʃaʁl ɑ̃ʁi kleʁɛl də tɔkvil]; 29 July 1805 – 16 April 1859) was a French diplomat, political scientist, and historian. He was best known for his works Democracy in America (appearing in two volumes: 1835 and 1840) and The Old Regime and the Revolution (1856). In both he analyzed the improved living standards and social conditions of individuals, as well as their relationship to the market and state in Western societies. Democracy in America was published after Tocqueville's travels in the United States and is today considered an early work of sociology and political science.
Tocqueville was active in French politics, first under the July Monarchy (1830–48) and then during the Second Republic (1849–51) which succeeded the February 1848 Revolution. He retired from political life after Louis Napoléon Bonaparte's 2 December 1851 coup, and thereafter began work on The Old Regime and the Revolution.
He argued the importance of the French Revolution was to continue the process of modernizing and centralizing the French state which had begun under King Louis XIV. The failure of the Revolution came from the inexperience of the deputies who were too wedded to abstract Enlightenment ideals. Tocqueville was a classical liberal who advocated parliamentary government, but he was skeptical of the extremes of democracy."""
203,Max Stirner,Modern,"""Johann Kaspar Schmidt (October 25, 1806 – June 26, 1856), better known as Max Stirner, was a German philosopher. He is often seen as one of the forerunners of nihilism, existentialism, psychoanalytic theory, postmodernism, and individualist anarchism. Stirner's main work is The Ego and Its Own, also known as The Ego and His Own (Der Einzige und sein Eigentum in German, which translates literally as The Individual and His Property). This work was first published in 1845 in Leipzig, and has since appeared in numerous editions and translations."""
204,Augustus De Morgan,Modern,"""Augustus De Morgan (; 27 June 1806 – 18 March 1871) was a British mathematician and logician. He formulated De Morgan's laws and introduced the term mathematical induction, making its idea rigorous."""
205,John Stuart Mill,Modern,"""John Stuart Mill (20 May 1806 – 8 May 1873) was an English philosopher, political economist and civil servant. One of the most influential thinkers in the history of liberalism, he contributed widely to social theory, political theory and political economy. Dubbed 'the most influential English-speaking philosopher of the nineteenth century', Mill's conception of liberty justified the freedom of the individual in opposition to unlimited state and social control.
Mill was a proponent of utilitarianism, an ethical theory developed by his predecessor Jeremy Bentham, and contributed significantly to the theory of the scientific method.
A member of the Liberal Party, he was also the first Member of Parliament to call for women's suffrage."""
